[
  {
    "dealId": "0192f0c8-3c4e-7a2b-8c3d-4e5f6a7b8c9d",
    "slot": "A",
    "purpose": "dkg",
    "participants": [
      {
        "identifier": "0100000000000000000000000000000000000000000000000000000000000000",
        "keyId": "deal/A/phone",
        "role": "phone"
      },
      {
        "identifier": "0200000000000000000000000000000000000000000000000000000000000000",
        "keyId": "deal/A/second-authenticator",
        "role": "second-authenticator"
      },
      {
        "identifier": "0300000000000000000000000000000000000000000000000000000000000000",
        "keyId": "agent/recovery-1",
        "role": "recovery-agent"
      }
    ]
  }
]
